Title,Link,Date,Author
Solution Architecture Part 5: Designing A Well-Optimised Web Scraping Solution,https://blog.scrapinghub.com/solution-architecture-part-5-designing-a-solution-estimating-resource-requirements,"July 04, 2019 ",Ian Kerins
Solution Architecture Part 4: Accessing The Technical Feasibility of Your Web Scraping Project,https://blog.scrapinghub.com/solution-architecture-part-4-accessing-the-technical-feasibility-of-your-web-scraping-project,"June 13, 2019 ",Ian Kerins
Visual Web Scraping Tools: What to Do When They Are No Longer Fit For Purpose?,https://blog.scrapinghub.com/visual-web-scraping-tools-what-to-do-when-they-are-no-longer-fit-for-purpose,"May 30, 2019 ",Ian Kerins
Solution Architecture Part 3: Conducting a Web Scraping Legal Review,https://blog.scrapinghub.com/solution-architecture-part-3-conducting-a-web-scraping-legal-review,"May 23, 2019 ",Sanaea Daruwalla
ScrapyRT: Turn Websites Into Real-Time APIs,https://blog.scrapinghub.com/scrapyrt-turn-websites-into-real-time-apis,"May 14, 2019 ",Pawel Miech
Web Data Analysis: Exposing NFL Player Salaries With Python,https://blog.scrapinghub.com/web-data-analysis-exposing-nfl-player-salaries-with-python,"May 09, 2019 ",Attila Tóth
From The Creators Of Scrapy: Artificial Intelligence Data Extraction API,https://blog.scrapinghub.com/artificial-intelligence-data-extraction-api,"April 11, 2019 ",Ian Kerins
Scrapinghub’s New AI Powered Developer Data Extraction API for E-Commerce & Article Extraction,https://blog.scrapinghub.com/developer-data-extraction-api-for-product-article-extraction,"April 09, 2019 ",Ian Kerins
Solution Architecture Part 2: How to Define The Scope of Your Web Scraping Project,https://blog.scrapinghub.com/web-scraping-requirement-gathering,"April 05, 2019 ",Ian Kerins
How to Architect a Web Scraping Solution: The Step-by-Step Guide,https://blog.scrapinghub.com/architecting-a-web-scraping-solution,"March 28, 2019 ",Ian Kerins
